city,region,department,policy_id,title
厦门市,厦门市,厦门市交通局,B48970A839F30772F14E9D463FEDA379,对涉路行政许可施工的质量验收及对安全的监督检查
厦门市,厦门市,厦门市交通局,C20B06DEF105B454F5DBBAE3C961B891,公路水运建设项目中标人将中标项目转让给他人等的处罚（含3个子项）
厦门市,厦门市,厦门市交通局,077DCE0BBEC16B62371B6606C69DA6A8,对拒绝、阻碍道路运输管理机构依法履行放射性物品运输安全监督检查，或者在接受监督检查时弄虚作假的处罚（含2个子项）
厦门市,厦门市,厦门市交通局,BF8B522D4C2D6B471FD7E7798AE52D81,公路工程监理企业丙级资质复查
厦门市,厦门市,厦门市交通局,49EB6A9D9223BAADB043DB20417D99E1,对道路货物运输经营和货运站经营活动的监督检查
厦门市,厦门市,厦门市交通局,0DFD1DE6DC7D435729A92EF6F8D6754E,对造成公路损坏未报告的处罚
厦门市,厦门市,厦门市交通局,F1B4DF5FD66219A5433A105A9B3C8ED8,对擅自在公路上设卡、收费的处罚
厦门市,厦门市,厦门市交通局,2BE0D573EC0316453413A73F1BFAEBA4,施工前未对有关安全施工的技术要求作出详细说明的；未根据不同施工阶段和周围环境及季节、气候的变化，在施工现场采取相应的安全施工措施，或者在城市市区内的建设工程的施工现场未实行封闭围挡的等的处罚 （含5个子项）
厦门市,厦门市,厦门市农业农村局,F1219BBDF03F7D8E6751DEA3B5D12B41,农药经营者经营劣质农药的处罚
厦门市,厦门市,厦门市农业农村局,14AD3EF115FA5EC3D95B86A0B3D262AA,未经调入地动物防疫监督机构批准，从县境外调入动物、动物产品给予警告的处罚
厦门市,厦门市,厦门市农业农村局,ADA71CD5AAC21117878611825878FBA1,超标准、超范围向农民收取款物（用工）的处罚
厦门市,厦门市,厦门市农业农村局,5502C257592BB24FB4D23844E94FE6B9,驾驶拼装或者擅自改装的实行牌证管理的自走式农业机械的处罚
厦门市,厦门市,厦门市农业农村局,6592BFA21B7D2E613373A2BB24857950,未经批准擅自引进农业生物物种的处罚
厦门市,厦门市,厦门市农业农村局,501A07683DA75831778ECB72B9873409,"屠宰、经营、运输的动物未附有检疫证明，经营和运输的动物产品未附有检疫证明、检疫标志的，参加展览、演出和比赛的动物未附有检疫证明的处罚
（含2个子项）"
厦门市,厦门市,厦门市农业农村局,1961A2684363E4FBFC4C1946C7425486,兽药监督检查
厦门市,厦门市,厦门市农业农村局,97B46877CF9CFABBAE55475906C08513,饲料、饲料添加剂监督检查
厦门市,厦门市,厦门市农业农村局,BE92CFFD1CEBD7E530CE1071A1F46F9C,屠宰、经营、运输依法应当检疫而未经检疫或者检疫不合格的动物，或者生产、经营、加工、贮藏、运输依法应当检疫而未经检疫或者检疫不合格的动物产品的处罚
厦门市,厦门市,厦门市农业农村局,EE80ADF69EB051BCD33A497FADFFA96D,对被审计单位转移、隐匿、篡改、毁弃会计报表、凭证、账簿以及其他有关的资料的处罚
厦门市,厦门市,厦门市水利局,C27AF941443DE05AC045D92905C9BAED,对拒不执行审批机关作出的取水量限制决定，或者未经批准擅自转让取水权的处罚
厦门市,厦门市,厦门市水利局,C16A8496D8A8E8E57D77076BD495DE31,指导水利突发公共事件的应急管理工作
厦门市,厦门市,厦门市水利局,A13D483BA8BB773C896A22414367AFC7,组织拆除或者封闭逾期不拆除或者不封闭的非法取水工程或者设施
厦门市,厦门市,厦门市水利局,93E979CD19D2AA2C6A1FF2C64D3DC70C,对施工图设计文件修改未报原审批部门批准，擅自用于施工的处罚
厦门市,厦门市,厦门市水利局,02273319C8DD277D0FB450483FFFDB75,对未按照规划治导线整治河道和修建控制引导河水流向、保护堤岸等工程，影响防洪的处罚
厦门市,厦门市,厦门市水利局,13AAD69685D9E3D184EAE272A8595011,强行拆除严重影响防洪的工程设施
厦门市,厦门市,厦门市水利局,0F32044597CC418498F6F326C22B64CF,对水库、水电站、拦河闸坝等工程的管理单位以及其他经营工程设施的经营者拒不服从统一调度和指挥的处罚
厦门市,厦门市,厦门市水利局,8CBF4E2744932FF0979A361C0ED8FBAD,对勘察单位因提供的勘察成果不真实、不准确，设计单位因设计不合理导致生产安全事故发生的处罚
厦门市,厦门市,厦门市水利局,2B793DE0A5A992ADD3F6BCF9CC145145,组织实施防洪论证制度
厦门市,厦门市,厦门市水利局,60995CD7308038379F9E5213FB41D9C6,对在河道保护管理工作中突出贡献的单位和个人的奖励
厦门市,厦门市,厦门市海洋局,133A8F6278DFC53E3EE893018BC246AA,对非法生产水产苗种的处罚
厦门市,厦门市,厦门市海洋局,C40839DD6F47EED4E5E8741DE9A102D3,渔业船舶抵押权确认
厦门市,厦门市,厦门市海洋局,8BC8D05DC2896728862D61F4EDFB6256,对未经批准出售、购买、利用、运输、携带、邮寄国家重点保护的水生野生动物及其制品的处罚
厦门市,厦门市,厦门市海洋局,05C861ED77970EAFE2E773F4388F1A53,无公害水产品认定
厦门市,厦门市,厦门市海洋局,74B9D3F3A3B1730A2FC5A8F15620F521,拟订海洋经济和渔业发展有关政策、规划并组织实施
厦门市,厦门市,厦门市海洋局,770472600540A409E053E20C010A1F6E,渔业捕捞许可证核发（含3个子项）
厦门市,厦门市,厦门市海洋局,77047260053FA409E053E20C010A1F6E,渔业捕捞许可证核发（含3个子项）
厦门市,厦门市,厦门市海洋局,770472600542A409E053E20C010A1F6E,渔业船员证书签发（含2个子项）
厦门市,厦门市,厦门市海洋局,0BABA618F64EDF1570B90B8A492D7B11,政府投资的渔港建设项目的竣工验收
厦门市,厦门市,厦门市海洋局,8F7AB316A3575102DBE80EFE96F889D7,不按规定申报营运检验和临时检验，逾期不改正的处罚
厦门市,厦门市,厦门市商务局,60CF97B5C8AF42A628F27F4D1E6E0EF2,对外承包工程单位违反质量、安全、应急管理等行为的处罚
厦门市,厦门市,厦门市商务局,14927AE1794F8A026AF3478BA50EB934,部分商品国营贸易出口企业资格的初审
厦门市,厦门市,厦门市商务局,DD43ED21659D964E7C8E1A98CC8414B1,外商投资企业或其投资者未经审批在限制投资领域投资经营的处罚
厦门市,厦门市,厦门市商务局,AADBACF5AC427DCCFB4751D59C6013CB,台湾投资者经第三地转投资确认
厦门市,厦门市,厦门市商务局,11D6417D4C23254621DA300F17A10C10,对外劳务合作企业未按照规定缴存或者补足备用金的处罚
厦门市,厦门市,厦门市商务局,D549302753F8CB6E797658569034386A,酒类批发者不办理备案登记、变更手续的处罚
厦门市,厦门市,厦门市商务局,E2BF69E7E82197917D1E3E1B4264679F,对外劳务合作企业组织劳务人员赴国外工作违规的处罚
厦门市,厦门市,厦门市商务局,874AD105F2306E318DC32B613675BA99,对外承包工程单位违规承揽工程项目、投标、签订协议、分包或者进行商业贿赂行为的处罚
厦门市,厦门市,厦门市商务局,271E68C701690F4B202AB1D81ABBA41D,对外劳务合作企业违规组织劳务人员赴国外工作的处罚
厦门市,厦门市,厦门市商务局,8E234240D398B39684E4220FF626A73B,外商投资企业或其投资者在禁止投资领域投资经营的处罚
厦门市,厦门市,厦门市文旅局,37C69A0A9F3EF2CD4DA8D5A79CCCFDA1,对《出版物市场管理规定》第三十四条条规定的违法情形的处罚（含3个子项）
厦门市,厦门市,厦门市文旅局,54EF981EA46F42D7921B6FDA6275AC84,对《复制管理办法》第四十条规定的违法情形的处罚（含4个子项）
厦门市,厦门市,厦门市文旅局,DEDF57B454AB829F8C0EE97E96EBED08,对《中华人民共和国文物保护法》第七十四条规定的违法情形的处罚（含2个子项）
厦门市,厦门市,厦门市文旅局,EEF390A04D19951398051CE063DE7B77,对《网络游戏管理暂行办法》第三十条规定的违法情形的处罚（含5个子项）
厦门市,厦门市,厦门市文旅局,24F14B2407CCDA8A41214049C39F89A8,对未取得相应等级的文物保护工程资质证书，擅自承担文物保护单位的修缮、迁移、重建工程的处罚
厦门市,厦门市,厦门市文旅局,62009614BF628A205A028EA6D8EFA7E2,对未取得资质证书，擅自从事馆藏文物的修复、复制、拓印活动的处罚
厦门市,厦门市,厦门市文旅局,9889306893D9EEDF6A6745F8DEAC68CE,对未经批准擅自修复、复制、拓印、拍摄馆藏珍贵文物的处罚
厦门市,厦门市,厦门市文旅局,FB930B94A8189AFB0F2E3188E8B8201C,对《出版管理条例》第六十六条规定的违法情形的处罚（含2个子项）
厦门市,厦门市,厦门市文旅局,C99868F6A570A533037822800439D69E,对承接含有损害我国国家尊严、荣誉和利益，危害社会稳定，伤害民族感情等内容的境外电影的洗印、加工、后期制作等业务的处罚
厦门市,厦门市,厦门市文旅局,81DA2969BCE9EDB18BB933CDED34DC4F,对《电子出版物出版管理规定》第六十条规定的违法情形的处罚（含5个子项）
厦门市,厦门市,厦门市体育局,364DEE76142F527E515EACF154E8C911,体育产业发展专项资金的审核
厦门市,厦门市,厦门市体育局,7688014F6A234859C70E9654557C3120,组织全市体育竞技体育综合性运动会的竞赛工作
厦门市,厦门市,厦门市体育局,46CD6ED982E8564754B598968F4C0FF9,运动员技术等级称号授予
厦门市,厦门市,厦门市体育局,1DA3BC5A0FC570B4EA9FF77E5030D058,体育类社会组织登记初审
厦门市,厦门市,厦门市体育局,A686BDBC27D85D4B299A466D667CD258,体育类社会组织等级年检初审
厦门市,厦门市,厦门市体育局,8967E2D4C77CC3F4C56068110956C3F9,承担体育体制机制改革工作
厦门市,厦门市,厦门市体育局,2CFE627178E767E4C7C9374B3E769E5C,拟订全市体育产业政策和发展规划并组织实施
厦门市,厦门市,厦门市体育局,C424154C325CCC782B5805E555071701,组织拟订和实施全市群众体育、全民健身工作发展规划、计划和政策
厦门市,厦门市,厦门市体育局,C67AC3A045136EAB665E008D7FD4D424,指导体育训练工作和体育科研工作
厦门市,厦门市,厦门市体育局,B5A9CADDA378D123418D078A4308F1E1,综合整理和提供全市性体育产业统计数据
厦门市,厦门市,厦门市应急局,CEF7D3FDF1081CD6C13AD7F7CAB049CF,第二、三类易制毒化学品生产、经营备案
厦门市,厦门市,厦门市应急局,3FA6C2A6099BC65CAD950B6C7F76F210,按要求建立统一的应急管理信息系统，负责信息传输渠道的规划和布局，指导落实监测预警和灾情报告制度，健全自然灾害信息资源获取和共享机制，依法统一发布灾情
厦门市,厦门市,厦门市应急局,6ED9EF2D3A0B7638025E3AD806B1AA8C,企业在安全使用许可证有效期内主要负责人、企业名称、注册地址、隶属关系发生变更，未按照规定的时限提出安全使用许可证变更申请或者将隶属关系变更证明材料报发证机关的处罚
厦门市,厦门市,厦门市应急局,0CB4B63C86FBB91283D047A46350D09A,矿山企业未制定领导带班下井制度的等的处罚(含3个子项）
厦门市,厦门市,厦门市应急局,8192C9A8847DC1A9E13979AD4F5C8968,到期不缴纳罚款的，每日按罚款数额的3%加处罚款，但不得超过罚款数额
厦门市,厦门市,厦门市应急局,19E1ECD30198709A4C50E70CE02DA04B,地质勘探单位未按照规定建立有关安全生产制度和规程等的处罚(含3个子项）
厦门市,厦门市,厦门市应急局,C0A702746B34ED2C0BD293159F2B62E2,承担市政府安全生产委员会、市减灾委员会、市突发公共事件应急委员会的日常工作
厦门市,厦门市,厦门市应急局,61CE512F06A2EDD0833F58665D30FD94,小型露天采石场有可能危及对方生产安全的相邻采石场，双方未按规定签订安全生产管理协议等的处罚（含9个子项）
厦门市,厦门市,厦门市应急局,F59AFCD1A844CFCD73169CC2C90030CF,制定应急物资储备和应急救援装备规划并组织实施，会同市发展和改革委员会、市民政局、市工业和信息化局、市商务局等部门建立健全应急物资调拨制度，在救灾时统一调度
厦门市,厦门市,厦门市应急局,21E5868AECC0E3F90C6B01F40FFFEB99,生产经营单位及其有关人员弄虚作假，骗取或者勾结、串通行政审批工作人员取得安全生产许可证书及其他批准文件等的处罚(含2个子项）
厦门市,厦门市,厦门市统计局,CA9893AAE56093519839B607B8C35830,组织实施能源、投资、消费、价格、收入、科技、人口、劳动力、社会发展基本情况、环境基本状况等统计调查，收集、汇总、整理和提供有关调查的统计数据，综合整理和提供资源、房屋、对外贸易、对外经济等全市性基本统计数据（含5个子项）
厦门市,厦门市,厦门市统计局,869212C80E97ADBD9B5A12B061DED4AE,对统计调查对象拒报统计资料，提供不真实、不完整统计资料，拒绝、阻碍统计检查等的处罚（含5个子项）
厦门市,厦门市,厦门市统计局,207B1238DE71CDAD83CAB204DA946605,对统计调查对象迟报统计资料或未按照国家有关规定设置原始记录、统计台账的处罚（含2个子项）
厦门市,厦门市,厦门市统计局,019B25B8D32004756783AE64771A1EAB,会同有关部门组织实施全市人口、经济、农业等重大国情国力普查，汇总、整理和提供有关国情国力方面的统计数据（含3个子项）
厦门市,厦门市,厦门市统计局,53909F1A617900F88435FD3C96878EF1,涉外调查的监督检查
厦门市,厦门市,厦门市统计局,3A134476296B71664BDC9116C003D5A7,人口普查的监督检查
厦门市,厦门市,厦门市统计局,5A86EACC64011F090D9A842A8854CA95,发布安全生产指标完成情况
厦门市,厦门市,厦门市统计局,D73CB4EDA2545301096B7B5A90C509C8,组织各区各部门的经济、社会、科技和资源环境统计调查，检查、审定、管理、公布、出版全市性基本统计资料，定期发布全市国民经济和社会发展情况的统计信息，组织建立服务业统计信息共享制度和发布制度（含3个子项）
厦门市,厦门市,厦门市统计局,3B13B4098A2F19E471D270199313BCA4,依法管理部门统计标准、统计调查项目和各区统计调查项目，指导专业统计基础工作、统计基层业务基础建设，建立健全统计数据质量审核、监控和评估制度并组织实施，依法监督管理涉外调查活动；组织实施全市统计系统的依法行政工作，加强监督检查，开展统计巡查工作（含3个子项）
厦门市,厦门市,厦门市统计局,5FF16EFD4CBD5D40E4A16407C7893A2F,对全市国民经济、社会发展、科技进步和资源环境等情况进行统计分析、统计预测和统计监督，向市委、市政府及有关部门提供统计信息和咨询建议；开展统计科学研究工作（含4个子项）
厦门市,厦门市,厦门市人防办,BEAFD785A0F1C3E864EB440379426890,单建式人防工程项目审批（1万平方米以下）
厦门市,厦门市,厦门市人防办,761FC77EF60003975714751D4598A941,编制全市人防工程建设规划，纳入人民防空建设总体规划并组织实施
厦门市,厦门市,厦门市人防办,A75D017BAF2F8DFF2127B3304195FB03,人防工程及设施开发利用
厦门市,厦门市,厦门市人防办,9A620C557BE2F37E6919E804673CF725,编制全市人民防空事业发展中长期规划
厦门市,厦门市,厦门市人防办,33DE5470CA2B336B4B4D6720F8A779B3,负责编制全市防空通信、警报建设规划，组织人民防空通信、警报网的建设和管理
厦门市,厦门市,厦门市人防办,540540F88E34ED65EFC196D1609E3175,对城市新建民用建筑项目的监管
厦门市,厦门市,厦门市人防办,98E5714BC881CDCA89F5C8827BEFD354,对人民防空工程防护设备定点生产企业的监管
厦门市,厦门市,厦门市人防办,7D413E7AAE6E2F30DC741CB2E23B9AF9,人防工程质量的监督检查
厦门市,厦门市,厦门市人防办,6F18B4DD3787487AA2EF2A0B62AF26DB,群众防空组织的监督
厦门市,厦门市,厦门市人防办,B7FB58C31D8A37CDE24D7013B62A0666,人防设备生产安装监管
厦门市,厦门市,厦门市自规局,7A830D80D3FF178D9DF69487B46CA277,对在自然保护区内违法进行砍伐、放牧、狩猎、捕捞、采药、开垦、烧荒、开矿、采石、挖沙等活动的处罚
厦门市,厦门市,厦门市自规局,05F51EA2820CA327E83E521DACEBAAE1,责令海域使用权人开发利用已批准使用的海域
厦门市,厦门市,厦门市自规局,33C6A6B459F945A118C1E6F0044C803E,海域使用金减免初审
厦门市,厦门市,厦门市自规局,1A02029ACFC35E31C07431DBD29BF6D2,国有土地上私人危住房翻改建（含鼓浪屿）审批
厦门市,厦门市,厦门市自规局,A1E140AFFAB19C72DDC364D103D689E8,在禁止开垦区内进行土地开垦的处罚
厦门市,厦门市,厦门市自规局,85BDA0F46F833B9B0F8F14522DA52CCB,买卖、出租、抵押或者以其他形式违法转让矿产资源的处罚
厦门市,厦门市,厦门市自规局,65EFAA0319AFB1D777D9EA7873830E9B,非法转让矿业权或以承包等方式将采矿权转给他人进行采矿的处罚
厦门市,厦门市,厦门市自规局,2B1F1E0AA4CCB2AB1D784EFEE8DFF81A,非法印制或者伪造、冒用勘查、采矿许可证的处罚
厦门市,厦门市,厦门市自规局,04CFFD43539D4F2307EF971FD6A83AF2,逾期不汇交地质资料的处罚
厦门市,厦门市,厦门市自规局,B41F011710EE640B0EB9333525E5E504,违反地质勘查资质有关规定的处罚
厦门市,厦门市,厦门市市政园林局,FF21D4EE3C7A797D2363A135757E6FA9,占用、挖掘城市防洪防海潮设施审批
厦门市,厦门市,厦门市市政园林局,737D878471EEC5C6FFBA2D21224353C8,植物及植物产品检验费征收
厦门市,厦门市,厦门市市政园林局,301C15E50930B7515EFCA4D8C12CF31B,林木种子采种林确定
厦门市,厦门市,厦门市市政园林局,003114F659FF4246E011890ABF3BBAB7,对在植物检疫工作中作出显著成绩的单位和个人的奖励
厦门市,厦门市,厦门市市政园林局,8B1C84A0A560D1BC7282AFE96C5E9624,占道管理费征收
厦门市,厦门市,厦门市市政园林局,5D3C141A4E223C343D0D879B1752AD7B,森林公园认定
厦门市,厦门市,厦门市市政园林局,140815F2814ED783FE5526805003BACE,组织风景名胜资源的调查评价和审查申报工作
厦门市,厦门市,厦门市市政园林局,1F6D094BECC95B2A3C5187C7189043E5,负责城市道路、桥梁、城市地下管廊、路灯、供水、排水、城镇燃气、市容环卫、园林绿化、污水及垃圾处理等行业的安全生产监督管理，组织开展城镇燃气安全生产专项整治
厦门市,厦门市,厦门市市政园林局,A6C935EB1ED3DBF5DB8F804D81E38DD3,编制本行政区域的森林防火规划
厦门市,厦门市,厦门市市政园林局,3D59AE98685C65B91BC56F21AA6FF597,对森林病虫害不除治或者除治不力行为的处罚
厦门市,厦门市,厦门市港口局,286D3AD1D77945E9AF607C21BDD131F3,省级有关部门核准、备案的和省级以下有关部门审批、核准、备案的水运建设工程项目施工图设计审批
厦门市,厦门市,厦门市港口局,5B84FFE4695EB798B5F0B980C53F9B6D,港口危险货物重大危险源备案
厦门市,厦门市,厦门市港口局,515547E603E3D75C587BE85C7E132420,危险货物港口经营人重大事故隐患排查处理情况备案
厦门市,厦门市,厦门市港口局,8B5157E3E3F9F55467A211BFFEFC4936,国内船舶管理业务审批
厦门市,厦门市,厦门市港口局,4E715813199EECC225991B97378DB63F,港口危险货物重大危险源备案
厦门市,厦门市,厦门市港口局,1D554E15B80B7BB1D166C2F7ADE00D27,办理《港口经营许可证》
厦门市,厦门市,厦门市港口局,1566DE8CD75823644A6D1CCA7EF98C1D,港区内港航设施使用非深水岸线审批（3000吨级以下泊位）（简化优化流程）
厦门市,厦门市,厦门市港口局,B4359FCC2616D886233D30391DF40E13,水运工程建设项目竣工验收
厦门市,厦门市,厦门市港口局,B46888B3688C0132521057902547F0EF,对《中华人民共和国港口法》第四十五条规定的违法情形的行政处罚
厦门市,厦门市,厦门市港口局,676C2AFDC70DCD66C677BCDC80FA6243,对国内水路运输市场的监督检查
厦门市,厦门市,厦门市执法局,34DDCC41D6A657096A237ED7E4EC9A06,对正在占用土地资源进行违法施工破坏自然资源的，城市管理行政执法部门依法作出责令当事人限期履行排除妨碍、恢复原状等义务的行政决定后，当事人逾期不履行，经催告仍不履行的代履行
厦门市,厦门市,厦门市执法局,5EBCB3183822FF0B00F41CC0FE985A13,查封施工现场、强制拆除(含3个子项）
厦门市,厦门市,厦门市执法局,A05423B6B911B69DAD4AE3CEC14478F0,查封其从事无证经营的场所或者查封、扣押专门用于无证经营的工具、设备、原材料、产品(商品)等财物
厦门市,厦门市,厦门市执法局,BAF7EABD9299D50A00133EA1A452B4BF,对违反公安交通管理方面法律、法规、规章规定的对非机动车侵占城市道路行为的处罚
厦门市,厦门市,厦门市执法局,0B8A86906986B6DC70439F936C27B27A,责令限期拆除无法采取改正措施消除对规划实施影响的城镇违法建筑
厦门市,厦门市,厦门市执法局,7D02BD8DBC4D8A79B757B5F5FD325D2F,对违反厦门市互联网租赁自行车管理的处罚（含9个子项）
厦门市,厦门市,厦门市执法局,846A6ECF2918C85C2616AA1ED3D58FEF,对违反厦门市机动车停车场管理方面法规规定的处罚权（含2个子项）
厦门市,厦门市,厦门市执法局,E3AA48EDCF4246557C98A2C11584F3E5,扣留不合格的燃气气瓶
厦门市,厦门市,厦门市执法局,978E81029871256BC4D313509D34CC0C,查封施工现场、扣押施工工具和强制拆除
厦门市,厦门市,厦门市执法局,9AFA1481C1CA9BCC5E73FCF481EAF12D,予以拆除未按临时建设工程规划许可证进行建设的，逾期不改正的建设
厦门市,厦门市,厦门市火炬管委会,39809B5D4AFBA60BB47860AA2E39EF0B,小额贷款公司变更审批
厦门市,厦门市,厦门市火炬管委会,A25B55EEBFC64021A91804E17A768B3C,对外贸易经营者备案登记
厦门市,厦门市,厦门市火炬管委会,B9E3D118D64EEAC2E77DC3123DAC6F7F,企业投资项目备案管理
厦门市,厦门市,厦门市火炬管委会,7704725FFBE6A409E053E20C010A1F6E,负责社保补差相关事项办理
厦门市,厦门市,厦门市火炬管委会,7704725FFBE7A409E053E20C010A1F6E,小额贷款公司筹建、开业、变更及终止初审
厦门市,厦门市,厦门市火炬管委会,7704725FFBE5A409E053E20C010A1F6E,企业或项目入区核准
厦门市,厦门市,厦门市国安局,770472610294A409E053E20C010A1F6E,涉及国家安全事项的建设项目审批
厦门市,厦门市,厦门市档案局,998E83F005063761A88066578DF4ADD3,重点建设工程档案的专项验收
厦门市,厦门市,厦门市档案局,4C91037F9CCBEB4CA0A6E6AEC21FD64C,机关、团体、企业、事业单位和其他组织档案管理情况登记以及重大活动、重要会议建档情况登记
厦门市,厦门市,厦门市档案局,286517102CF0B9A6DF803C718110CFFF,重点建设项目和重大科研项目档案保管情况登记以及竣工验收和成果鉴定档案的备案
厦门市,厦门市,厦门市档案局,BDFE6ED85655482701448DEEE0181E69,公民、法人或者其他组织设立档案服务机构备案
厦门市,厦门市,厦门市档案局,C21C8555E1E13A4AD350389915416C29,文件材料归档范围和保管期限核准
厦门市,厦门市,厦门市档案局,C09213ABD14E3AAC35CBD189ED43A68F,制定和实施全市档案事业发展规划
厦门市,厦门市,厦门市档案局,3570523B689AF6546BB54EDB95596213,携带、运输、邮寄档案出境审批
厦门市,厦门市,厦门市档案局,927D54C6CE55C0ED3229A74A17050A85,城市建设档案馆接收规定范围以外档案审批
厦门市,厦门市,厦门市档案局,C5C7CEC755050CF0F341B76852F5F50D,延期向社会开放档案审批
厦门市,厦门市,厦门市档案局,F1D228DADEAE8ACA7AB3A3E4D3ED3C56,市级专门档案馆、区综合档案馆的收集档案范围细则的审核
厦门市,厦门市,厦门市气象局,F0D3AD8F5CFB7A23C63D7442A328721E,违反防雷装置安装、设计、施工、检测管理规定的处罚
厦门市,厦门市,厦门市气象局,91234BAB257256BFAA67835E6CB2C48F, 气象灾害调查、鉴定
厦门市,厦门市,厦门市气象局,C7A79F7DFAACDCF03108E3CC9B77F344,危害气象探测环境行为的处罚
厦门市,厦门市,厦门市气象局,71DE4FBE0752C870239314F0B4338EBE,气象设施和气象探测环境保护的监督管理
厦门市,厦门市,厦门市气象局,4CAAB8B3B15B966E38DFD519284572E3,雷电灾害防御工作的监督管理
厦门市,厦门市,厦门市气象局,F9C05A75C0EE5164F24D92DD9ACCAAF9,升放无人驾驶自由气球或者系留气球活动审批
厦门市,厦门市,厦门市气象局,29B5F9648458651C6E4765E76BDB4FAE,雷电防护装置设计审核和竣工验收
厦门市,厦门市,厦门市气象局,2462400D1800BE5F25A2B37BBB55AD64,升放无人驾驶自由气球、系留气球单位资质认定
厦门市,厦门市,厦门市气象局,9EB14E7ED297AEC5F8ED3E3CC11D4DD9,新建、扩建、改建建设工程避免危害气象探测环境审批初审
厦门市,厦门市,厦门市气象局,FB6B886A247906A9F45981800808506F,升放无人驾驶自由气球、系留气球单位资质认定
厦门市,厦门市,厦门市消防救援支队,D9DB8353723A403B3D9E8E4DCA25936F,公众聚集场所消防安全告知承诺
