city,region,department,policy_id,title
泉州市,泉州市,泉州市住房公积金中心,9A559BC7DEBEAD320CE9C41B531D2EFF,负责各管理部住房公积金会计核算工作
泉州市,泉州市,泉州市住房公积金中心,72565AED05F5BFF6D62B3CE89F656F4B,单位逾期不缴或少缴住房公积金的处罚
泉州市,泉州市,泉州市住房公积金中心,2FB745A35815C4E2191112A917128882,单位不办理住房公积金缴存登记或不为本单位职工办理住房公积金帐户设立手续的处罚
泉州市,泉州市,泉州市住房公积金中心,788A6B5C438701309DF0458E4D4CCF06,编制全市住房公积金归集和使用计划指标完成情况表及报告。
泉州市,泉州市,泉州市住房公积金中心,C31E2261D5E4A8D0787CA2867BF6FD1D,负责信访工作
泉州市,泉州市,泉州市医保局,770472615AC2A409E053E20C010A1F6E,基本医疗保险费和生育保险费征缴核定
泉州市,泉州市,泉州市医保局,770472615AC3A409E053E20C010A1F6E,医疗保险、生育保险基金支付（含2子项）
泉州市,泉州市,泉州市医保局,FCC5C5DBB28B0E80C2BBE4E6C3E8BA5D,城乡居民医疗救助待遇支付
泉州市,泉州市,泉州市医保局,770472615AC1A409E053E20C010A1F6E,基本医疗保险服务、生育保险服务
泉州市,泉州市,泉州市医保局,31F66BFAE0EF15F912D0D4FAF2DCE349,基本门诊医疗保险门诊特殊病种和治疗项目认定
泉州市,泉州市,泉州市医保局,81EE5CA50D823F039AB07C2236219D79,基本医疗保险家庭病床申请认定和延期审核
泉州市,泉州市,泉州市医保局,770472615AC4A409E053E20C010A1F6E,市本级二等乙级以上革命伤残军人医疗管理（含2个子项）
泉州市,泉州市,泉州市社保中心,30C4F1B9AB0271F28C6DE6754B16A864,社会保险缴费申报
泉州市,泉州市,泉州市社保中心,2F92E1785C73CFF604B963E94DE10563,社会保障卡服务
泉州市,泉州市,泉州市社保中心,180B2B743CE7DA645524443C6AD9FF7B,社会保险参保信息维护
泉州市,泉州市,泉州市社保中心,2CD05C653C0A974B6D23550A1373DC67,社会保险参保缴费记录查询
泉州市,泉州市,泉州市社保中心,1D8F606914AF30BA913C6E81288354DE,养老保险服务（含12个子项）
泉州市,泉州市,泉州市社保中心,F607C6894EE442149B144D05650BE5AA,工伤保险服务
泉州市,泉州市,泉州市社保中心,37338A59BBE4FA42929CA13E254A9432,社会保险待遇领取资格认证
泉州市,泉州市,泉州市社保中心,C5BA8B32AC126F652AB5B1265CE470BA,社会保险登记
泉州市,泉州市,泉州市社保中心,D00C382D08F3A80186D81B0BCBD20399,养老保险服务
泉州市,泉州市,泉州市社保中心,9E410CC5ECE0FC4DCF6141A5CC7DF306,劳动能力鉴定
泉州市,泉州市,泉州市自来水公司,7B7B7351D4C14305F3EA5CBA52747B70,工程款缴交
泉州市,泉州市,泉州市自来水公司,1A53192179651217D0AD945FABF5087E,用水报装
泉州市,泉州市,泉州市自来水公司,757410B9FB78F24848E35816632EAFA1,用水申请
泉州市,泉州市,泉州市自来水公司,ED64A02192F351279AB5265AF24D1A0C,换取增值税普通发票
泉州市,泉州市,泉州市自来水公司,B4970AEBF68BB812656229AB463C6B14,报停、销户业务
泉州市,泉州市,泉州市自来水公司,968B2C5345CFBD7A33E432A096158BAA,水表过户
泉州市,泉州市,泉州市自来水公司,2FEA2326A4F2271D0B720530656A446F,更换发票
泉州市,泉州市,泉州市自来水公司,288B05F9791BE84D2FEBDEE60ECE093C,用水过户
泉州市,泉州市,泉州市法律援助中心,6F90DA67C1E073AB38FBDBA5887D6A33,法律援助
泉州市,泉州市,泉州市建设系统培训中心,7704726105F7A409E053E20C010A1F6E,建筑施工单位的主要负责人、项目负责人、专职安全生产管理人员及建筑施工特种作业人员岗位考核发证（含2个子项）
泉州市,泉州市,泉州市建设系统培训中心,7704726105F6A409E053E20C010A1F6E,建筑施工单位的主要负责人、项目负责人、专职安全生产管理人员及建筑施工作业人员岗位考核发证
泉州市,泉州市,泉州市建设系统培训中心,0E40D6B7C1394174675335D4E2E8BB50,建筑施工企业专业管理人员岗位培训考核及证书发放
泉州市,泉州市,泉州市建设系统培训中心,B992BE29FB8F4E92746CBBA286662FDC,建设行业职业技能鉴定审核转报
泉州市,泉州市,泉州市就业和人才人事公共服务中心,262FC31FFDEF91EC0D0386204B246D16,失业保险待遇核定支付
泉州市,泉州市,泉州市新闻出版局,69F2E493DC6EF85CF48BB9C3F4DD74F7,新闻记者采编活动（报刊类）的监督管理
泉州市,泉州市,泉州市新闻出版局,3F04027DEB2B570284F06CC3FE2D60D6,内部资料性出版物的监督管理
泉州市,泉州市,泉州市新闻出版局,BDB2CDC6B9015A70EA1D6C17BAD2C129,出版物发行单位或者出版单位设立不具备法人资格的发行分支机构备案
泉州市,泉州市,泉州市新闻出版局,2614D4D4BA418EC4A99A221D2FADED6D,《内部资料性出版物准印证》补发
泉州市,泉州市,泉州市新闻出版局,FCC52AB6BB54D80A969D22CB6A35344B,监督管理驻泉新闻单位
泉州市,泉州市,泉州市新闻出版局,D37B28D9B1E852BEF59B6EA6D0F02803,电影的监督管理
泉州市,泉州市,泉州市新闻出版局,8ECAD7F76D8DD35C0D08DD43DFBC1D0E,对损害公共利益的信息网络侵权行为的处罚
泉州市,泉州市,泉州市新闻出版局,D2CE332D789771B5A4567A6D32F76143,违反展会知识产权保护规定行为的处罚
泉州市,泉州市,泉州市新闻出版局,90AED2A54806ABD7D3D7ABADEF01CCB9,承印加工境外包装装潢和其他印刷品备案核准
泉州市,泉州市,泉州市新闻出版局,32D558A9C4560C6F667BFF14346C722B,认定非法出版物
莆田市,莆田市,莆田市金融办,63C174477ADE41919D266630B5147210,小额贷款公司名称变更批复
莆田市,莆田市,莆田市金融办,A196A032FE3FA859763391791D274E4C,内资融资租赁试点企业申请转报
莆田市,莆田市,莆田市金融办,BF3F8E0E75931E8CD245F6050D6543EF,区域性股权市场运营机构经营范围调整、新增或者变更交易品种
莆田市,莆田市,莆田市金融办,059C84796B3E72068370BD90BC927FBE,设立典当行及分支机构审批（设立、变更、注销）
莆田市,莆田市,莆田市金融办,DB5526FCEBA674F12757329D0B227A74,区域性股权市场运营机构名称变更
莆田市,莆田市,莆田市金融办,3832656CE67421087F15EF9B56F98D56,区域性股权市场运营机构注册资本变更
莆田市,莆田市,莆田市金融办,3301285AD9500F1F2EE6685364B39118,小额贷款公司设立（开业）批复
莆田市,莆田市,莆田市金融办,E167172AAFC7EF46C1BB1F08DF97FD21,融资担保公司变更事项备案
莆田市,莆田市,莆田市金融办,72266EC163E8168BA1CECB565DF28612,小额贷款公司增加注册资本批复
莆田市,莆田市,莆田市金融办,CAEA6974542923FE1DE377BFD2A1DCC1,小额贷款公司减少注册资本批复
莆田市,莆田市,莆田市退役军人局,1C7E071003F33558A54D3F66A6DC6692,自主择业军转干部退役金发放预审录入
莆田市,莆田市,莆田市退役军人局,DEE6FD50A9ACA09A8DDC12F9F7BFEDC8,承担市双拥共建工作领导小组办公室的日常工作
莆田市,莆田市,莆田市退役军人局,8B032C44F8EC3575377E7087ABCA5644,计划分配军队转业干部在中央、省直在莆单位、市属单位的安置
莆田市,莆田市,莆田市退役军人局,767FC995F9D22493651B0A30A4341AF5,带病回乡退伍军人的身份认定
莆田市,莆田市,莆田市退役军人局,71FC6DEFF2BD6F0E827A38B6B0C792D4,恢复被判处有期徒刑、剥夺政治权利或者被通缉期间抚恤优待对象的抚恤优待的审核转报
莆田市,莆田市,莆田市退役军人局,9C5D2EC5CBBA239601127A0829A1767C,集中交接符合政府安排工作条件的退役士兵档案审查以及易地安置资格确认
莆田市,莆田市,莆田市退役军人局,447F1D9D4D4F384ED5F1DE6258BD899E,指导协调贯彻落实拥军优属、拥政爱民政策
莆田市,莆田市,莆田市退役军人局,A0916A4D19B2FAEC393A5EE4BE0278E7,协调开展双拥宣传工作，总结推广双拥工作经验
莆田市,莆田市,莆田市退役军人局,F76B41D130011B1AA8878E75C1FCF4CB,取消被判处死刑、无期徒刑抚恤优待对象的抚恤优待资格的审核转报
莆田市,莆田市,莆田市退役军人局,61052AFB2BBE7E4D4133BC90CEF43E07,烈士纪念设施的保护管理
莆田市,莆田市,莆田市市场监管局,540D7C08EFEAD0EC52F5E4CAAF5448C0,对未主动收集并按照时限要求报告医疗器械不良事件等的处罚（含4个子项）
莆田市,莆田市,莆田市市场监管局,C4E28A9AD358D0FCEFB95DC4E65307D8,对乳制品生产企业违反规定不停止生产不召回乳制品的处罚
莆田市,莆田市,莆田市市场监管局,2D7D136F47D00C516CFE25C83B55CF5F,对食品生产经营者违法采购生产经营的处罚
莆田市,莆田市,莆田市市场监管局,8AD3BCBC33935ECAD32446EDC0FA9C1C,毛绒纤维经营者销售毛绒纤维违反规定的处罚(含7个子项)
莆田市,莆田市,莆田市市场监管局,806CDCDFD6F49A71EE3E9991368FABD1,对未按照规定建立电子台账及时上传食品安全追溯信息的处罚
莆田市,莆田市,莆田市市场监管局,D330C9D28C91CFCBE0004C69F6969683,对生产企业违反《生产实施细则》规定生产等的处罚（含7个子项）
莆田市,莆田市,莆田市市场监管局,AD326B3BF01BFB619496287D0508F91F,对医疗器械经营企业、使用单位未按照规定建立医疗器械不良事件监测和再评价工作制度的等的处罚（含6个子项）
莆田市,莆田市,莆田市市场监管局,94DAE4FFA3EC17840DA3372301064F9C,对持有人未按照规定建立医疗器械不良事件监测和再评价工作制度的等的处罚（含11个子项）
莆田市,莆田市,莆田市市场监管局,5C52CC117EAFD3ED58BBA84DCF93769E,对已取得《无菌器械产品注册证》的企业新建、改建厂房未经批准擅自生产等的处罚（含2个子项）
莆田市,莆田市,莆田市市场监管局,8706CD6D4ED99E4B2BB1E79B9DD355C8,对销售、使用未获得生物制品批签发证明的行政处罚
莆田市,莆田市,莆田市发改委,D54576583297E42C122D83CB813F191B,对实行核准管理的项目违法行为的处罚
莆田市,莆田市,莆田市发改委,14F31DC96CD42C52C0F0FAE56493A89F,对粮食收购者不履行收购义务的的处罚
莆田市,莆田市,莆田市发改委,1BFF853987C40DBEC666F335B1DD5C44,对粮食经营者不建立粮食质量安全档案的处罚
莆田市,莆田市,莆田市发改委,25BA5E8616D647DCA571CECF90047E41,对国有粮油仓储单位未及时备案的处罚
莆田市,莆田市,莆田市发改委,C4953970C4FD2BFE1B2AE6C17619184E,对召回的粮食不进行无害化处理或不按规定用途处理的处罚
莆田市,莆田市,莆田市发改委,742510D08962F4AF389CC114C4380563,负责涉案财物价格认定及复核
莆田市,莆田市,莆田市发改委,05E07A6FEE0D10ED08DDEB3D7CA9EA4B,粮食收购资格认定
莆田市,莆田市,莆田市发改委,267B9B93EC495BF6B8D418E5FC1EB970,对实行备案管理的项目违法行为的处罚
莆田市,莆田市,莆田市发改委,5D9206E19081CB36542E8CC147169818,违反价格监测管理规定行为的处罚
莆田市,莆田市,莆田市发改委,AF710D37B1018EB6A2176B495F5AC38B,对从事粮食收购、销售、储存、加工的粮食经营者及用粮企业未建立粮食经营台账或者未按照规定报送粮食基本数据和有关情况的处罚
莆田市,莆田市,莆田市审计局,636D34E21E9E5F774524D48581659DCD,对事业组织、社会团体审计监督
莆田市,莆田市,莆田市审计局,BB5BD4AD71515AC103E6680A4762F7B7,政府部门管理和其他单位受政府委托管理的基金、资金审计监督
莆田市,莆田市,莆田市审计局,2A8EF8BDB8F77E27B7730C09E69B429D,对单位和个人违反财政收入票据管理规定行为的处罚 （含4个子项）
莆田市,莆田市,莆田市审计局,D68D21D8598EC448C58B26EFA02F34D6,对本级各部门和下级政府预算的执行情况和决算及其他财政收支审计监督
莆田市,莆田市,莆田市审计局,A48D566C89DD178AFAC231EA7A465259,领导干部任期经济责任审计监督
莆田市,莆田市,莆田市审计局,D285AADEEE17F8A4746EA587621ACCB1,指导和监督属于审计机关审计监督对象的单位的内部审计工作
莆田市,莆田市,莆田市审计局,11B4DAE25647539959C87CB255623090,根据上级审计机关授权对中央、省驻莆单位、金融机构和项目审计监督
莆田市,莆田市,莆田市审计局,02D87A27BE35D1434E72D7F809F1826B,审计机关审计项目质量检查
莆田市,莆田市,莆田市审计局,644EBCFB08E205D73CA353F0AAB06216,对国有金融机构审计监督
莆田市,莆田市,莆田市审计局,6DBC7239E474594A8B6333253C277CC6,对国家机关及其工作人员违反规定使用、骗取财政资金行为的处罚 （含4个子项）
莆田市,莆田市,莆田市工信局,3212C457B0DFECD6E4263AF6F1578233,对从事危害电力设施行为的处罚
莆田市,莆田市,莆田市工信局,1EBD6CBB2862CC54BE49EEFED2B59A49,招标人以不合理的条件限制或者排斥潜在投标人，对潜在投标人实行歧视待遇，强制要求投标人组成联合体共同投标的，或者限制投标人之间竞争的处罚
莆田市,莆田市,莆田市工信局,E3135458407C75DC1BA5C2AF18284B49,节能审查（固定资产投资项目）
莆田市,莆田市,莆田市工信局,A68285CCCED988C59D8B1C696989BD63,对石油天然气管道企业未履行管道保护责任的处罚
莆田市,莆田市,莆田市工信局,42C1C2E0286E2E376EB9224112409AE7,投标人相互串通投标或者与招标人串通投标，投标人以向招标人或者评标委员会成员行贿的手段谋取中标的处罚
莆田市,莆田市,莆田市工信局,E778F0DAF98620F3F98C614F7C7FDC15,评标委员会成员收受投标人的财物或者其他好处，评标委员会成员或者参加评标的有关工作人员向他人透露对投标文件的评审和比较、中标候选人的推荐以及与评标有关的其他情况的处罚
莆田市,莆田市,莆田市工信局,634C5FE7E64C1EBE563CD89654249E90,中标人将中标项目转让给他人的；将中标项目肢解后分别转让给他人的；违反本法规定将中标项目的部分主体、关键性工作分包给他人，或者分包人再次分包的处罚
莆田市,莆田市,莆田市工信局,7FD6433D8B1037B9191797C680080727,拒报、虚报、漏报或者瞒报有关监控化学品数据的处罚
莆田市,莆田市,莆田市工信局,4EC578F2C18A3A6B4F601953372469B9,变质或者过期失效的监控化学品处理方案批准
莆田市,莆田市,莆田市工信局,FE33393E9E1CC205121CDCE24575CC64,投标人以他人名义投标或者以其他方式弄虚作假，骗取中标的的处罚
莆田市,莆田市,莆田市民族宗教局,9EDB18D494EF5FA3C3B45E5DA78F52B2,民族宗教团体成立、变更、注销前审查及年度检查的初审（含4个子项）
莆田市,莆田市,莆田市民族宗教局,9A26C7B0D7D5F677D58B02553D5730C8,假冒宗教教职人员进行宗教活动或者骗取钱财等违法活动的处罚
莆田市,莆田市,莆田市民族宗教局,91EDCA39B1D6DB5680BF8B5272F012ED,筹备设立宗教活动场所审批（含4个子项）
莆田市,莆田市,莆田市民族宗教局,AEB132405BF810993C88C7699D2CA26E,申请变更民族成份的审核
莆田市,莆田市,莆田市民族宗教局,247DAF16460AFFFE23A92308A8986355,宗教活动场所主要教职（兼任或跨省的）担任或者离任备案
莆田市,莆田市,莆田市民族宗教局,7134C01E679B78FD483C5EE811B507A8,负责民族宗教政府信息公开工作
莆田市,莆田市,莆田市民族宗教局,78A31CBCF0C043D1F3BC8D3E18482BDC,推进民族、宗教事务信息化建设
莆田市,莆田市,莆田市民族宗教局,EF04A40DC65D6960345C40DF0184FD8E,检查指导基层政府宗教事务部门做好民间信仰活动的管理工作
莆田市,莆田市,莆田市民族宗教局,EDCF42E39CC2E55044FAD35322DB7515,协调县区政府、宗教工作部门及时妥善处理民间信仰方面的重大问题
莆田市,莆田市,莆田市民族宗教局,40CA750CE244777FC8238D6F36EDAC4F,开展宗教教育培训审批
莆田市,莆田市,莆田市民政局,9452B54A9F78D6B2565CD49099FD7FA0,对社会团体在申请登记时弄虚作假，骗取登记，或者自取得《社会团体法人登记证书》之日起1年未开展活动的处罚
莆田市,莆田市,莆田市民政局,6B3A049893749FCCECC6FE2AE2782AFD,对擅自设置地名标志的处罚
莆田市,莆田市,莆田市民政局,515F41075D6B40DCA58162E63907D607,对未经批准，擅自兴建殡葬设施的处罚
莆田市,莆田市,莆田市民政局,BA9BB419DFC284D3E587DF6B204CFE3C,对慈善组织违法行为的处罚（含10个子项）
莆田市,莆田市,莆田市民政局,C4145DDC42F54170F9300F7A6B0EB5B9,对社会组织的监督检查（含3个子项）
莆田市,莆田市,莆田市民政局,C357D04043E4B4D4B1998E92469EDDE4,对社会团体违规使用登记证书、超范围活动、乱收费的处罚（含8个子项）
莆田市,莆田市,莆田市民政局,D81083A42E6EF96B34DE8964C757DE54,取缔非法民间组织
莆田市,莆田市,莆田市民政局,4A773543C6FF258A91CEC97883C10C34,"对养老机构违法经营和不接受监督检查的处罚
（含7个子项）"
莆田市,莆田市,莆田市民政局,3088D56EADE3185DDD11C413178D2BDF,对未使用标准地名或者未按照国家规定书写、译写、拼写标准地名的处罚
莆田市,莆田市,莆田市民政局,5B45917CC0DFE095921ED491C59BB4DF,"对基金会不按规定开展业务、接受监督检查的处罚
（含6个子项）"
莆田市,莆田市,莆田市财政局,ABE2010226C74B4179BFF7EE80E2A56F,对政府采购供应商在政府采购活动中存在违法行为的处罚（含6个子项）
莆田市,莆田市,莆田市财政局,BE7AC10B981A66910E3877A4764E0526,对政府采购评审专家、评标委员会、谈判小组、询价小组成员违法行为的处罚（含6个子项）
莆田市,莆田市,莆田市财政局,81D00A070760ACEE2FE8437CA19FE7DE,贯彻执行国家有关财税法律法规和政策，起草并组织实施全市财税地方性法规、规章和政策；拟订并组织实施财税发展战略、规划和改革方案，分析预测宏观经济形势，参与制定各项宏观经济政策，提出运用财税政策实施宏观调控和综合平衡社会财力的建议；拟订市与县区(管委会)、政府与企业的分配政策，完善鼓励公益事业发展的财税政策（含3个子项）
莆田市,莆田市,莆田市财政局,7AECCF932AB87FAF304CBFFE22F7E2B9,对事业单位、社会团体、其他社会组织及其工作人员在经营活动中财政违法行为的处罚
莆田市,莆田市,莆田市财政局,B96E3DDE23BAD34C7C41695E34C55838,对海域使用金缴纳情况的监督检查
莆田市,莆田市,莆田市财政局,5375BCE5377A84C7100D13716AA61DEC,残疾人就业保证金减免核准
莆田市,莆田市,莆田市财政局,2202BE7E3C71D178066E935C5D25BD22,对政府采购事务中采购人、采购代理机构及其工作人员与供应商恶意串通、接受贿赂或获取其他不正当利益、在依法实施的监督检查中提供虚假情况、开标前泄露标底的处罚（含4个子项）
莆田市,莆田市,莆田市财政局,712C54F7DB7AB2A82F0A4F5AB91FAFB4,对授意、指使、强令会计机构、会计人员及其他人员伪造、变造会计凭证、会计账簿，编制、对外提供虚假的或者隐瞒重要事实的财务会计报告，或者隐匿、故意销毁依法应当保存的会计凭证、会计账簿、财务会计报告的处罚
莆田市,莆田市,莆田市财政局,4C473297FF11CF0C109568218D84D5EB,对单位和个人伪造、变造会计凭证、会计账簿，编制、对外提供虚假的或者隐瞒重要事实的财务会计报告的处罚
莆田市,莆田市,莆田市财政局,D9DDC7B4915DBC2AACCF6AC2901F1E6A,编制年度财务会计报告前未清查全部资产和债务，对账簿记录与实物、款项不符事项未按规定进行会计处理，委托不具备会计代理记账资格的中介机构代理记账的处罚
莆田市,莆田市,莆田市人社局,5590DEC9977ACDFAC47DB3244867490A,用人单位制定的劳动规章制度违反法律、法规规定的处罚
莆田市,莆田市,莆田市人社局,5706C2898BAD790EFD1EDD4BC16DCC58,用人单位招用人员提供虚假招聘信息发布虚假招聘广告、招用无合法身份证件人员、以招用人员为名牟取不正当利益或进行其他违法活动的处罚
莆田市,莆田市,莆田市人社局,37884B535949BB9BB360D35EAD7A485C,骗取社会保险待遇的处罚
莆田市,莆田市,莆田市人社局,74C918DF465125D4483F06B7081488A6,职业资格培训、职业技能培训民办学校违法取得回报的处罚
莆田市,莆田市,莆田市人社局,81ED23E3C52F9D546BDB2D1F2AEAD90D,人才中介机构及其他主体无《许可证》从事人才中介服务等行为的处罚（含6个子项）
莆田市,莆田市,莆田市人社局,BC5A460160012C436CFFEEEC937822A3,未经批准擅自设立中外合作职业技能培训机构，或者以不正当手段骗取中外合作职业技能培训办学许可证的处罚
莆田市,莆田市,莆田市人社局,0B29D4E388D7EEBC04A71BD67B347FF2,中外合作职业技能培训机构管理混乱、教育教学质量低下，造成恶劣影响的处罚
莆田市,莆田市,莆田市人社局,E244EEDB95A5DCE93EA90DC1E9D48FA0,娱乐场所招用未成年工的处罚
莆田市,莆田市,莆田市人社局,3BD06670840EFCB3ADEB273082A57684,设立中外合资（合作）职业介绍机构审批
莆田市,莆田市,莆田市人社局,7650B19963CB698B45E431FEB08E48EC,用人单位以担保或者其他名义向劳动者收取财物及违法扣押劳动者档案或者其他物品的处罚
莆田市,莆田市,莆田市科技局,143EE60D92CB14A5B85288DEF2A5BAB1,外国人来华工作许可
莆田市,莆田市,莆田市科技局,390243828F7FAF970519B4895C0333E6,国家级科技企业孵化器的审核转报
莆田市,莆田市,莆田市科技局,91DD03560EC75B783C3383006AF81A00,省特殊支持科技创新、创业领军人才遴选
莆田市,莆田市,莆田市科技局,BE1B5857F2CBE64A0173545083FD4C12,省级科技特派员选任转报
莆田市,莆田市,莆田市科技局,D673DE5470F26FA361A76FC9C6E69128,国家科技计划项目（含基地、产业集群）的审核转报 
莆田市,莆田市,莆田市科技局,0341A31CC8BF602A7ACD90F270C7D934,科技型中小企业评价
莆田市,莆田市,莆田市科技局,50DD41F613434C939BBA8E8966E99D04,省级新型研发机构评估
莆田市,莆田市,莆田市科技局,5679A85F7DA7472D6FE97AEE57DB07F7,科技小巨人企业评估
莆田市,莆田市,莆田市科技局,64CD80FCF4144C41D1CF0A50344BE822,国家野外科学观测研究站审核转报
莆田市,莆田市,莆田市科技局,D1BBAAFAA63AC77612618447273A6F42,国家级国际科技合作基地的审核转报
莆田市,莆田市,莆田市文旅局,AC58202F2F46F5C2081482D9D7874431,地方对等交流互办单一国家电影展映活动转报
莆田市,莆田市,莆田市文旅局,217D535CA51655047B79BF8482DF08BA,市级文物保护单位保护范围内的土地征收（用）审核
莆田市,莆田市,莆田市文旅局,06F9576AFED23E2F6B241010183C08EF,《广播电视节目制作经营许可证》登记事项变更的审核
莆田市,莆田市,莆田市文旅局,C5F65C7545B521E6E38B49ABF9BBA913,卫星地面接收设施安装服务许可证审核
莆田市,莆田市,莆田市文旅局,AA0C043577CCCB6C93E477CF998117A0,设置卫星地面接收设施接收境内电视节目审核
莆田市,莆田市,莆田市文旅局,FDABA52E361491A85333650BB5AB2E7C,无线广播电视发射设备订购证明转报
莆田市,莆田市,莆田市文旅局,EF647267C98C12636032B75760D83018,新闻记者证年度核验初审
莆田市,莆田市,莆田市文旅局,5ED13B6212E6EAC5B4F4A0BB7F438680,出版物批发单位变更出版物经营许可证登记事项审批
莆田市,莆田市,莆田市文旅局,D91031658A420C1FC80CA6B19503EFBB,设立广播电台、电视台开办频率频道的审核转报
莆田市,莆田市,莆田市文旅局,620D8E024C3FF711F0D510361BED7C3C,广播电台、电视台变更台名、节目套数、节目设置范围及传输覆盖范围、方式、技术参数审核
莆田市,莆田市,莆田市卫健委,1580180EBA0C9930463284B4831D3981,从事放射卫生技术服务机构资质证书核发
莆田市,莆田市,莆田市卫健委,F1362C3D19E2665C1FA862FFC523DDDD,职业病危害项目申报
莆田市,莆田市,莆田市卫健委,27E791D93CDDC483BF1BA89AAD7CBE6C,涉及饮用水卫生安全的产品卫生许可
莆田市,莆田市,莆田市卫健委,F5C3648785CE4570B5A8DD24B9C84184,公共场所预防性卫生审查
莆田市,莆田市,莆田市卫健委,C25020A803CE47C91C7D1E45C17AF3C7,对医疗机构购置、使用不合格或国家有关部门规定淘汰的放射诊疗设备等行为的处罚
莆田市,莆田市,莆田市卫健委,2B036F6A8681879C90997C6BF5658BB7,对以不正当手段取得医师执业证书的处罚
莆田市,莆田市,莆田市卫健委,911969B032398DDFA7EC1B42220D254A,对医师违反卫生行政规章制度或者技术操作规范，造成严重后果等行为的处罚
莆田市,莆田市,莆田市卫健委,5A39B015AA70CBCBE20789DAB5F9876F,对放射工作单位未按照规定组织放射工作人员培训等行为的处罚
莆田市,莆田市,莆田市卫健委,0669E5F6FD3BC95CDB779D8D799DB362,对医疗机构未履行告知程序擅自进行新生儿疾病筛查等行为的处罚
莆田市,莆田市,莆田市卫健委,92240D0BFAC61854AC98D4C89A20F7CE,对医疗保健机构和计划生育技术服务机构的工作人员非法为他人进行胎儿性别鉴定或选择性别的终止妊娠手术的处罚
